{
    "data": [
        {
            "timestamp": "2023-05-05 22:27:47.508185",
            "certificate_ids": [
                "NIST-2247",
                "NSCIB-CC-13-37760-CR2"
            ],
            "metadata_header_url": "https://raw.githubusercontent.com/crocs-muni/seccerts-overlay/main/Demonstration%20Bindings/demonstration_data_header.json"
        }
    ],
    "author": "CROCS",
    "version": "1.0",
    "JWT": "eyJhbGciOiJIUzI1NiIsInR5cCI6IkpXVCJ9.eyJkYXRhIjpbeyJ0aW1lc3RhbXAiOiIyMDIzLTA1LTA1IDIyOjI3OjQ3LjUwODE4NSIsImNlcnRpZmljYXRlX2lkcyI6WyJOSVNULTIyNDciLCJOU0NJQi1DQy0xMy0zNzc2MC1DUjIiXSwibWV0YWRhdGFfaGVhZGVyX3VybCI6Imh0dHBzOi8vcmF3LmdpdGh1YnVzZXJjb250ZW50LmNvbS9jcm9jcy1tdW5pL3NlY2NlcnRzLW92ZXJsYXkvbWFpbi9EZW1vbnN0cmF0aW9uJTIwQmluZGluZ3MvZGVtb25zdHJhdGlvbl9kYXRhX2hlYWRlci5qc29uIn1dLCJhdXRob3IiOiJDUk9DUyIsInZlcnNpb24iOiIxLjAifQ.u3PaNTo7-xp-EKhUk_qGlkNujFHR78UvE_KamyPEmbE"
}